{
  "$schema": "https://json-schema.org/draft/2020-12/schema",
  "$id": "https://lk-robotics.github.io/schemas/lds-consumer-policy-contract.schema.json",
  "type": "object",
  "additionalProperties": false,
  "required": ["$schema", "schemaVersion", "kind", "id", "profile", "authority", "owner", "decision", "evidence"],
  "properties": {
    "$schema": { "const": "./ROBOTICS_POLICY_CONTRACT.schema.json" },
    "schemaVersion": { "const": 1 },
    "kind": { "const": "lds-consumer-policy-contract" },
    "id": { "type": "string", "pattern": "^[a-z0-9-]+$" },
    "profile": { "type": "string", "minLength": 1 },
    "authority": { "type": "string", "minLength": 1 },
    "owner": { "type": "string", "minLength": 1 },
    "decision": {
      "type": "object",
      "additionalProperties": false,
      "required": ["maxVisibleBadges", "visualStyle", "placement", "accessibleStateRetention", "renderers"],
      "properties": {
        "maxVisibleBadges": { "const": 1 },
        "visualStyle": { "const": "solid" },
        "placement": { "const": "attached-top-right" },
        "accessibleStateRetention": { "const": "all-raw-states" },
        "renderers": {
          "type": "object",
          "minProperties": 1,
          "additionalProperties": {
            "type": "object",
            "additionalProperties": false,
            "required": ["bodyChannel", "badgePriority"],
            "properties": {
              "bodyChannel": { "type": "string", "minLength": 1 },
              "badgePriority": {
                "type": "array",
                "minItems": 1,
                "uniqueItems": true,
                "items": { "type": "string", "minLength": 1 }
              }
            }
          }
        }
      }
    },
    "evidence": {
      "type": "array",
      "minItems": 1,
      "items": {
        "type": "object",
        "additionalProperties": false,
        "required": ["root", "file", "contains"],
        "properties": {
          "root": { "enum": ["lds", "consumer"] },
          "file": { "type": "string", "minLength": 1 },
          "contains": {
            "type": "array",
            "minItems": 1,
            "uniqueItems": true,
            "items": { "type": "string", "minLength": 1 }
          },
          "excludes": {
            "type": "array",
            "uniqueItems": true,
            "items": { "type": "string", "minLength": 1 }
          }
        }
      }
    }
  }
}
